startDate,Abstract Registration Due,Final Version Due,endDate,City,Acronym,Type,Title,Field,Submission Deadline,Country,Homepage,Notification Due
2017-03-28T00:00:00,,,2017-03-30T23:59:59,Osaka,ICCOE 2017,Conference,ICCOE  2017 : 2017 4th International Conference on Coastal and Ocean Engineering (ICCOE 2017),"environment, environmental engineering, civil engineering, engineering",2016-11-20T00:00:00,Japan,www.iccoe.org/,
2017-03-28T00:00:00,,,2017-03-30T23:59:59,Osaka,ICCFE 2017,Conference,ICCFE  2017 : 2017 4th International Conference on Chemical and Food Engineering (ICCFE 2017),"chemical, environmental engineering, sustainability, biology",2016-11-20T00:00:00,Japan,www.iccfe.org/,
2017-03-13T00:00:00,,,2017-03-15T23:59:59,Prague,ICCBS 2017,Conference,ICCBS  2017 : 2017 4th International Conference on Chemical and Biological Sciences(ICCBS 2017),"chemical, biology, biotechnology, biomedical engineering",2016-11-05T00:00:00,Czech Republic,www.iccbs.org/,
2017-03-28T00:00:00,,,2017-03-30T23:59:59,Osaka,ICBAE 2017,Conference,ICBAE  2017 : 2017 3rd International Conference on Biotechnology and Agriculture Engineering (ICBAE 2017),"biotechnology, agriculture, biology, environment",2016-11-20T00:00:00,Japan,www.icbae.org/,
2017-03-25T00:00:00,,,2017-03-27T23:59:59,Kyoto,ICSSH 2017,Conference,ICSSH  2017 : 2017 6th International Conference on Social Science and Humanity (ICSSH 2017),"society, social sciences, humanities, sociology",2016-11-20T00:00:00,Japan,www.icssh.org/,
2017-03-25T00:00:00,,,2017-03-27T23:59:59,Kyoto,ICLMC 2017,Conference,"ICLMC  2017 : 2017 6th International Conference on Language, Medias and Culture (ICLMC 2017)","language, media, culture, social science",2016-11-10T00:00:00,Japan,www.iclmc.org/,
2017-03-25T00:00:00,,,2017-03-27T23:59:59,Kyoto,ICEFR 2017,Conference,ICEFR  2017 : 2017 6th International Conference on Economics and Finance Research (ICEFR 2017),"economics, finance, e-commerce, business",2016-11-15T00:00:00,Japan,www.icefr.org/,
2017-03-12T00:00:00,,,2017-03-15T23:59:59,Kopaonik,ICIST 2017,Conference,ICIST  2017 : 7th International Conference on Information Society and Technology,"information systems, internet of things, software engineering, information society",2016-12-15T00:00:00,Serbia,www.yuinfo.org/icist2017/,
2017-03-10T00:00:00,,,2017-03-12T23:59:59,Paris,ICMEI 2017,Conference,ICMEI  2017 : 2017 5th International Conference on Management and Education Innovation (ICMEI 2017),"management, education, e-learning , higher education",2016-10-31T00:00:00,France,www.icmei.org/,
2017-02-10T00:00:00,2016-11-15T00:00:00,,2017-02-11T23:59:59,Palladam,I-SMAC 2017,Conference,"I-SMAC  2017 : IEEE International conference on I-SMAC (IoT in Social, Mobile, Analytics and Cloud)","networking and communication p, data processing techniques, robotic and electrical infrast, mobile services",2016-12-15T00:00:00,,ismac2017.com/index.html,2016-12-26T00:00:00
